SPCC613.06	rpl902	K02940	60S ribosomal protein L9
SPCC613.09	sen54	K15326	tRNA-splicing endonuclease subunit Sen54 (predicted)
SPCC1620.10	cwf26	K13106	complexed with Cdc5 protein Cwf26
SPBP8B7.09c	los1	K14288	karyopherin exportin T Los1 (predicted)
SPCC1442.09	trp3	K01657	anthranilate synthase component I (predicted)
SPCC1235.13	ght6	K08139	hexose transporter Ght6
SPAC1805.11c	rps2602	K02976	40S ribosomal protein S26
SPCC576.10c	rpt3	K03063	19S proteasome regulatory subunit Rpt3 (predicted)
SPCC1442.06	pre8	K02726	20S proteasome component alpha 2, Pre8 (predicted) 
SPCC1840.10	lsm8	K12627	U6 snRNP-associated protein Lsm8 (predicted)
SPCC1840.11	csl4	K07573	exosome subunit Csl4 (predicted)
SPBC16A3.05c	rae1	K14298	RNA export factor, nucleoporin Rae1
SPAC6G10.11c	ubi3	K02977	ubiquitin-40S ribosomal protein S31 fusion protein
SPCC1795.03	gms1	K15272	UDP-galactose transporter Gms1
SPBC337.06c	cwf15	K12863	complexed with Cdc5 protein Cwf15
SPBC16E9.11c	pub3	K10591	HECT-type ubiquitin-protein ligase Pub3 (predicted)
SPCC1672.10	mis16	K10752	kinetochore protein Mis16
SPCC188.02	par1	K11584	protein phosphatase regulatory subunit Par1
SPCC188.03	cnd3	K06678	condensin complex non-SMC subunit Cnd3
SPBC1718.01	pop1	K03361	cullin 1 adaptor protein Pop1
SPAC19G12.07c	rsd1	K13091	RNA-binding protein Rsd1 (predicted)
SPBC6B1.10	prp17	K12816	splicing factor Prp17
SPBC577.06c	stt4	K00888	1-phosphatidylinositol 4-kinase Stt4 (predicted) 
SPAC1805.06c	hem2	K01698	porphobilinogen synthase Hem2 (predicted) 
ScpofMp10	cox2	K02261	cytochrome c oxidase 2
SPAC6B12.09	trm10	K15445	tRNA m(1)G methyltransferase Trm10 (predicted)
SPAC6B12.08	mug185	K09506	Co-chaperone for ATPase activity (predicted)
SPCC1739.09c	cox13	K02266	cytochrome c oxidase subunit VIa (predicted) 
SPAC23D3.11	ayr1	K06123	1-acyldihydroxyacetone phosphate reductase (predicted) 
SPBC887.14c	pfh1	K15255	DNA repair and recombination protein
SPCC1739.12	ppe1	K15427	serine/threonine protein phosphatase Ppe1 
SPBC1A4.02c	leu1	K00052	3-isopropylmalate dehydrogenase Leu1 
SPBC428.08c	clr4	K11419	histone H3 methyltransferase Clr4
SPCC14G10.03c	ump1	K11599	proteasome maturation factor Ump1 (predicted)
SPBC36.05c	clr6	K06067	histone deacetylase (class I) Clr6
SPBC2G5.03	ctu1	K14168	cytosolic thiouridylase subunit Ctu1
SPCC1183.06	ung1	K03648	uracil DNA N-glycosylase Ung1 
SPAC167.04	pam17	K17806	TIM23 translocase complex-associated motor subunit Pam17 (predicted)
SPAC167.01	ire1	K08852	serine/threonine protein kinase Ppk4/sensor for unfolded proteins in the ER (predicted)
SPAC167.02	ptb1	K05956	geranylgeranyltransferase II beta subunit Ptb1
SPAC637.10c	rpn10	K03029	19S proteasome regulatory subunit Rpn10
SPAC926.05c	dph4	K17867	diphthamide biosynthesis protein Dph4 (predicted)
SPBC2D10.15c	pth1	K01056	mitochondrial peptidyl-tRNA hydrolase Pth1 (predicted) 
SPBC27.08c	sua1	K00958	sulfate adenylyltransferase 
SPBC713.02c	ubp15	K11838	ubiquitin C-terminal hydrolase Ubp15 
SPAC20G8.06	not1	K12604	CCR4-Not complex subunit Not1 (predicted)
SPCC1259.01c	rps1802	K02964	40S ribosomal protein S18
SPBP23A10.14c	ell1	K15183	RNA polymerase II transcription elongation factor SpELL
SPBP8B7.27	mug30	K12232	ubiquitin-protein ligase E3 (predicted)
SPBP8B7.25	cyp4	K03768	cyclophilin family peptidyl-prolyl cis-trans isomerase Cyp4 (predicted)
SPBP8B7.21	ubp3	K11841	ubiquitin C-terminal hydrolase Ubp3
SPAC2F3.10	vps54	K17600	GARP complex subunit Vps54 (predicted)
SPAC2F3.15	lsk1	K00916	P-TEFb-associated cyclin-dependent protein kinase Lsk1
SPAC22A12.11	dak1	K00863	dihydroxyacetone kinase Dak1 
SPBC32F12.03c	gpx1	K00432	glutathione peroxidase Gpx1 
SPCC162.09c	hmg1	K00021	3-hydroxy-3-methylglutaryl-CoA reductase Hmg1 
SPAC4D7.05	sum1	K03246	translation initiation factor eIF3i
SPAC4D7.03	pop2	K03361	F-box/WD repeat protein Pop2
SPBC16D10.04c	dna2	K10742	DNA replication endonuclease-helicase Dna2
SPAC4D7.09	tif223	K03241	translation initiation factor eIF2B gamma subunit (predicted)
SPAC17G6.04c	cpp1	K05954	protein farnesyltransferase beta subunit Cpp1 
SPAC12B10.05	icp55	K18573	mitochondrial intermediate cleavage peptidase Icp55 (predicted)
SPBC354.12	gpd3	K00134	glyceraldehyde 3-phosphate dehydrogenase Gpd3 
SPAC12B10.07	acp1	K10364	F-actin capping protein alpha subunit
SPBC1105.17	cnp1	K11495	centromere-specific histone H3 CENP-A
SPAC6F12.11c	sfc1	K15202	transcription factor TFIIIC complex A box associated subunit Sfc1
SPCC1827.08c	pof7	K10295	F-box protein Pof7
SPBC1198.14c	fbp1	K03841	fructose-1,6-bisphosphatase Fbp1
SPAC23G3.08c	ubp7	K11844	ubiquitin C-terminal hydrolase Ubp7
SPAC1B3.14	vma3	K02155	V-type ATPase V0 subunit c (proteolipid subunit) 
SPAC9.03c	brr2	K12854	U5 snRNP complex subunit Brr2 (predicted)
SPBC26H8.14c	cox17	K02260	cytochrome c oxidase copper chaperone Cox17 (predicted)
SPAC10F6.03c	cts1	K01937	CTP synthase Cts1 (predicted) 
SPAC20G4.02c	fus1	K17971	formin Fus1
SPAC17G8.07	yaf9	K11341	YEATS family histone acetyltransferase subunit Yaf9
SPAC3G6.13c	rpl4101	K02928	60S ribosomal protein L41
SPBC902.02c	ctf18	K11269	RFC-like complex subunit Ctf18
SPCC825.03c	psy1	K08486	SNARE Psy1
SPBC83.14c	rfc5	K10756	DNA replication factor C complex subunit Rfc5 (predicted)
SPAC1952.07	rad1	K02830	checkpoint clamp complex protein Rad1
SPAC1952.05	gcn5	K06062	SAGA complex histone acetyltransferase catalytic subunit Gcn5
SPAC1952.03	otu2	K18342	ubiquitin specific cysteine protease, OTU family, Otu2
SPBC83.03c	tas3	K11597	RITS complex subunit 3
SPCC965.05c	thp1	K03649	uracil DNA N-glycosylase Thp1 
SPAC4G9.10	arg3	K00611	ornithine carbamoyltransferase Arg3 
SPBC215.03c	csn1	K12175	COP9/signalosome complex subunit Csn1
SPBC8D2.15	lip5	K03644	mitochondrial lipoic acid synthetase Lip5 (predicted)
SPAC25G10.02	cce1	K17676	mitochondrial cruciform cutting endonuclease Cce1 
SPAC25G10.06	rps2801	K02979	40S ribosomal protein S28
SPCC1906.01	mpg1	K00966	mannose-1-phosphate guanyltransferase Mpg1 
SPAC19D5.06c	din1	K14845	Dhp1p-interacting protein Din1
SPAC2F7.03c	pom1	K18669	DYRK family protein kinase Pom1 
SPBC359.03c	aat1	K16261	amino acid permease
SPAC1093.06c	dhc1	K10413	dynein heavy chain Dhc1
SPAC1687.15	gsk3	K03083	serine/threonine protein kinase Gsk3
SPAC4F10.13c	mpd2	K18730	GYF domain protein
SPAC13A11.02c	erg11	K05917	sterol 14-demethylase (predicted) 
SPAPB2B4.05	vma5	K02148	V-type ATPase V1 subunit C (predicted) 
SPAPB2B4.03	cig2	K02220	G1/S-specific B-type cyclin Cig2
SPBC3D6.08c	lsm1	K12620	mRNA decapping complex subunit (predicted)
SPAC6G10.12c	ace2	K09238	transcription factor Ace2
SPAC14C4.03	mek1	K12776	meiosis-specific serine/threonine protein kinase 
SPAC821.08c	slp1	K03363	WD repeat-containing protein
SPBC16E9.12c	pab2	K14396	poly(A) binding protein Pab2
SPAC222.06	mak16	K14831	nuclear HMG-like acidic protein Mak16 (predicted)
SPAC222.09	seb1	K15560	RNA-binding protein Seb1
SPCC338.05c	mms2	K10704	ubiquitin conjugating enzyme Mms2
SPAC18G6.15	mal3	K10436	EB1 family Mal3
SPBC1347.01c	rev1	K03515	deoxycytidyl transferase Rev1 (predicted)
SPAC19G12.06c	hta2	K11251	histone H2A beta
SPAC637.07	moe1	K03251	translation initiation factor eIF3d Moe1
SPAPB8E5.02c	rpn502	K03035	19S proteasome regulatory subunit Rpn502
SPAC30D11.13	hus5	K10577	SUMO conjugating enzyme Hus5
SPAC30D11.12	rpl3802	K02923	60S ribosomal protein L38
SPAC30D11.10	rad22	K10873	DNA recombination protein Rad22
SPBC29B5.03c	rpl26	K02898	60S ribosomal protein L26
SPAC977.16c	dak2	K00863	dihydroxyacetone kinase Dak2 
SPBC23G7.16	ctr6	K14686	vacuolar copper transporter Ctr6
SPBC1348.14c	ght7	K08139	hexose transporter Ght7 (predicted)
SPCC1442.12	pps1	K17103	phosphatidylserine synthase Pps1 
SPAC1A6.09c	lag1	K04709	sphingosine N-acyltransferase Lag1
SPAC328.03	tps1	K00697	alpha,alpha-trehalose-phosphate synthase (UDP-forming) 
SPAC328.06	ubp2	K11849	ubiquitin C-terminal hydrolase Ubp2
SPAC3F10.18c	rpl4102	K02928	60S ribosomal protein L41
SPAP27G11.10c	nup184	K14311	nucleoporin Nup184
SPCC188.11	prp45	K06063	splicing factor Prp45
SPAC17A5.11	rec12	K10878	endonuclease Rec12
SPAC17A5.14	exo2	K12618	exonuclease II Exo2 
SPBC24C6.11	cwf14	K12873	G10 protein
SPAC227.08c	yth1	K14404	mRNA cleavage and polyadenylation specificity factor complex Yth1
SPCC18B5.03	wee1	K03114	M phase inhibitor protein kinase Wee1
SPBC405.07	rpl3602	K02920	60S ribosomal protein L36
SPCC1795.01c	mad3	K06680	mitotic spindle checkpoint protein Mad3
SPAC631.01c	acp2	K10365	F-actin capping protein beta subunit (predicted)
SPAC1D4.04	cct2	K09494	chaperonin-containing T-complex beta subunit Cct2
SPBC6B1.07	prp1	K12855	U4/U6 X U5 tri-snRNP complex subunit Prp1
SPCC16A11.17	mcm4	K02212	MCM complex subunit Mcm4/Cdc21
SPCC16A11.14	sfh1	K11770	RSC complex subunit Sfh1
SPAC9G1.02	wis4	K11230	MAP kinase kinase kinase Wis4
SPBC6B1.02	ppk30	K08853	Ark1/Prk1 family protein kinase Ppk30
SPCC4G3.15c	not2	K12605	CCR4-Not complex subunit Not2 (predicted)
SPAC23D3.07	pup1	K02739	20S proteasome component beta 2 (predicted) 
SPBC21.04	med8	K15130	mediator complex subunit Med8
SPAC23D3.02	rfc2	K10755	DNA replication factor C complex subunit Rfc2
SPAC11E3.04c	ubc13	K10580	ubiquitin conjugating enzyme Ubc13 
SPAC6B12.15	cpc2	K14753	40S ribosomal protein cpc2/RACK1
SPAC6B12.12	tom70	K17768	mitochondrial TOM complex subunit Tom70 (predicted)
SPAC23D3.09	arp42	K11400	SWI/SNF and RSC complex subunit Arp42
SPCC1739.03	hrr1	K11701	Helicase Required for RNAi-mediated heterochromatin assembly Hrr1
SPAC1F5.04c	cdc12	K17971	formin Cdc12
SPBC530.12c	pdf1	K07252	palmitoyl protein thioesterase-dolichol pyrophosphate phosphatase fusion 1 
SPAC24C9.10c	mrp4	K02967	mitochondrial ribosomal protein subunit S2 (predicted)
SPAC1805.12c	uep1	K02927	ubiquitin-60S ribosomal protein L40 fusion protein
SPAC4F8.07c	hxk2	K00844	hexokinase 2 
SPBC3B8.01c	arh1	K00528	NADPH-adrenodoxin reductase Arh1
SPAC24C9.07c	bgs2	K00706	1,3-beta-glucan synthase subunit Bgs2 
SPAC4F10.20	grx1	K03676	glutaredoxin Grx1
SPAC1B3.11c	ypt4	K07880	GTPase Ypt4
SPBC30D10.21	new18	K18170	mitochondrial protein
SPCC4B3.04c	nte1	K14676	lysophospholipase (predicted)
SPAC6F12.10c	ade3	K01952	phosphoribosylformylglycinamidine synthase Ade3 (predicted) 
SPCC1183.05c	lig4	K10777	DNA ligase Lig4
SPBC25H2.08c	mrs2	K16075	magnesium ion transporter Mrs2 (predicted)
SPBPJ4664.01	dps1	K05355	decaprenyl diphosphate synthase subunit Dps1 
SPBPJ4664.06	gpt1	K11718	UDP-glucose-glycoprotein glucosyltransferase Gpt1 
SPCC1442.08c	cox12	K02267	cytochrome c oxidase subunit VIb (predicted) 
SPBC13G1.10c	mug81	K18664	ATP-dependent RNA helicase Slh1 (predicted)
SPBC16H5.03c	fub2	K10685	SUMO E1-like activator enzyme Fub2 (predicted)
SPAC2C4.13	vma16	K03661	V-type ATPase V0 subunit c'' (predicted)
SPAC1F7.13c	rpl801	K02938	60S ribosomal protein L2
SPAC20G4.03c	hri1	K16194	eIF2 alpha kinase Hri1
SPBC1A4.03c	top2	K03164	DNA topoisomerase II 
SPAC144.03	ade2	K01939	adenylosuccinate synthetase Ade2 
SPCC330.14c	rpl2402	K02896	60S ribosomal protein L24
SPBC18E5.12c	mas2	K01412	mitochondrial processing peptidase(MPP) complex alpha subunit Mas2 (predicted) 
SPBC725.07	pex5	K13342	peroxisomal targeting signal receptor Pex5
SPBC336.14c	ppk26	K12572	serine/threonine protein kinase, PAN complex subunit, Ppk26
SPAC4D7.13	usp104	K12821	U1 snRNP-associated protein Usp104
SPBC26H8.01	thi2	K03146	thiazole biosynthetic enzyme
SPBC26H8.03	cho2	K16369	phosphatidylethanolamine N-methyltransferase Cho2 
SPBC146.14c	sec26	K17301	coatomer beta subunit (predicted)
SPAC23C11.04c	pnk1	K08073	DNA kinase/phosphatase Pnk1 
SPBC1105.05	exg1	K01210	glucan 1,6-beta-glucosidase Exg1 
SPBC1105.06	pmc4	K15146	mediator complex subunit Pmc4
SPAC27E2.05	cdc1	K02328	DNA polymerase delta small subunit Cdc1 
SPCC553.04	cyp9	K12736	WD repeat containing cyclophilin family peptidyl-prolyl cis-trans isomerase Cyp9 (predicted)
SPBC1105.09	ubc15	K10575	ubiquitin conjugating enzyme Ubc15 
SPAC27E2.09	mak2	K02486	histidine kinase Mak2
SPBC83.02c	rpl4302	K02921	60S ribosomal protein L43
SPBC24C6.06	gpa1	K04640	G-protein alpha subunit
SPBC2G2.15c	mrm2	K15508	mitochondrial 2' O-ribose methyltransferase Mrm2 (predicted)
SPAC1B3.05	not3	K12580	CCR4-Not complex subunit Not3/5 (predicted)
SPAPB1A10.04c	cwp1	K05955	geranylgeranyltransferase I alpha subunit Cwp1
SPAC27F1.09c	prp10	K12828	U2 snRNP-associated protein Sap155
SPBC18H10.08c	ubp4	K11839	ubiquitin C-terminal hydrolase Ubp4
SPAC22F8.10c	sap145	K12829	U2 snRNP-associated protein Sap145 (predicted)
SPCC31H12.07	sec231	K14006	COPII cargo receptor subunit Sec23a (predicted)
SPAC1687.06c	rpl44	K02903	ribosomal L28e protein family domain-containing protein
SPAC2F7.13c	wrs1	K01867	tryptophan-tRNA ligase Wrs1 (predicted) 
SPAC31G5.15	psd3	K01613	phosphatidylserine decarboxylase Psd3 
SPAC31G5.14	gcv1	K00605	glycine decarboxylase T subunit (predicted) 
SPCC663.01c	ekc1	K15501	protein phosphatase regulatory subunit Ekc1 (predicted)
SPAC32A11.04c	tif212	K03238	translation initiation factor eIF2 beta subunit (predicted)
SPAC31G5.13	rpn11	K03030	19S proteasome regulatory subunit Rpn11
SPAC6F12.03c	fsv1	K08501	SNARE Fsv1
SPAC1952.13	ned1	K15728	lipin Ned1 
SPBC36B7.03	sec63	K09540	ER protein translocation subcomplex subunit Sec63 (predicted)
SPBC2G2.03c	sbh1	K09481	translocon beta subunit Sbh1 (predicted)
SPBC36B7.07	tlg1	K08499	SNARE Tgl1 (predicted)
SPBC17A3.04c	rar1	K01874	cytoplasmic methionine-tRNA ligase Mrs1 (predicted) 
SPBC36B7.09	gcn2	K16196	eIF2 alpha kinase Gcn2
SPCC11E10.06c	elp4	K11375	elongator complex subunit Elp4 (predicted)
SPAC3A12.07	rpb11	K03008	RNA polymerase II complex subunit Rpb11
SPAC4G9.03	adk1	K00939	adenylate kinase Adk1 
SPAC4G9.02	rnh201	K10743	ribonuclease H2 complex subunit Rnh201 (predicted) 
SPBC16G5.14c	rps3	K02985	40S ribosomal protein S3
SPBC1539.08	arf6	K07941	ADP-ribosylation factor, Arf family Arf6
SPBC2A9.12	orc6	K02608	origin recognition complex subunit Orc6
SPCC1223.03c	gut2	K00111	glycerol-3-phosphate dehydrogenase Gut2 (predicted) 
SPBC428.05c	arg12	K01940	argininosuccinate synthase (predicted) 
SPCC16A11.02	utp13	K14555	U3 snoRNP-associated protein Utp13 (predicted)
SPAC1687.05	pli1	K04706	SUMO E3 ligase Pli1
SPAC29B12.02c	set2	K11423	histone lysine methyltransferase Set2
SPAC1687.01	rpc19	K03020	DNA-directed RNA polymerase I and III subunit Rpc19
SPBC1215.01	shy1	K14998	SURF-family protein Shy1 (predicted)
SPBC887.10	mcs4	K11233	response regulator Mcs4
SPBC887.11	pus2	K15452	tRNA pseudouridine synthase Pus2 (predicted) 
SPBC887.19	rft1	K06316	Man5GlcNac2-PP-Dol translocation protein Rft1 (predicted)
SPBC646.09c	int6	K03250	eukaryotic translation initiation factor 3 subunit E
SPAC18G6.03	ypt3	K07904	GTPase Ypt3
SPAC1071.10c	pma1	K01535	P-type proton ATPase, P3-type Pma1 
SPBC8D2.20c	sec31	K14005	COPII-coated vesicle component Sec31 (predicted)
SPCC970.12	mis18	K11564	kinetochore protein Mis18
SPAC1783.04c	hst4	K11121	Sir2 family histone deacetylase Hst4
SPAC17G8.04c	arc5	K05754	ARP2/3 actin-organizing complex subunit Arc5
SPCC1682.05c	srp68	K03107	signal recognition particle subunit (predicted)
SPAC17H9.17c	mdm10	K17774	Mdm10/Mdm12/Mmm1 complex subunit Mdm10 (predicted)
SPBC1289.07c	rpc40	K03027	DNA-directed RNA polymerase I and III subunit Rpc40 
SPAC1F5.07c	hem14	K00231	protoporphyrinogen oxidase (predicted) 
SPCC569.08c	ade5	K00601	phosphoribosylglycinamide formyltransferase (predicted) 
SPAC637.05c	vma2	K02147	V-type ATPase V1 subunit B 
SPBC29A3.07c	sab14	K12833	Pre-mRNA branch site p14-like protein
SPAC1B3.12c	rpb10	K03007	DNA-directed RNA polymerase I, II, and III subunit Rpb10
SPAC5H10.08c	pan6	K01918	pantoate-beta-alanine ligase 
SPBC30B4.04c	sol1	K11771	SWI/SNF complex subunit Sol1
SPBC13E7.10c	brf1	K15196	transcription factor TFIIIB complex subunit Brf1
SPBC1709.02c	vrs1	K01873	cytoplasmic valine-tRNA ligase Vrs1/Vas1 
SPCC191.07	cyc1	K08738	cytochrome c (predicted)
SPAC6C3.04	cit1	K01647	citrate synthase Cit1 
SPCC1672.08c	tfa2	K03137	transcription factor TFIIE beta subunit, TFIIEB, Tfa2
SPAC630.14c	tup12	K06666	transcriptional corepressor Tup12
SPAC6G9.10c	sen1	K10706	ATP-dependent 5' to 3' DNA/RNA helicase Sen1
SPBC146.12	coq6	K06126	monooxygenase Coq6 (predicted)
SPCC622.18	rpl6	K02934	60S ribosomal protein L6
SPAC17A5.01	pex6	K13339	peroxin-6 (predicted)
SPAC17A5.03	rpl301	K02925	60S ribosomal protein L3
SPAC17A5.06	ptr8	K10843	transcription factor TFIIH complex ERCC-3 subunit
SPAC2F3.03c	rpa49	K03005	DNA-directed RNA polymerase I complex subunit Rpa49 (predicted) 
SPCC24B10.11c	mft1	K13176	THO complex subunit 7 Mft1 (predicted)
SPBC24C6.05	sec28	K17268	coatomer epsilon subunit (predicted)
SPAPB18E9.01	trm5	K15429	tRNA (guanine) methyltransferase Trm5
SPAC25G10.05c	his1	K00765	ATP phosphoribosyltransferase 
SPAC18B11.07c	rhp6	K10573	ubiquitin-conjugating enzyme E2 2 
SPBC23E6.03c	nta1	K14663	protein N-terminal amidase nta1 
SPCC320.09	hem15	K01772	ferrochelatase (predicted) 
SPAC20H4.11c	rho5	K07975	Rho family GTPase Rho5
SPAC19B12.05c	fcp1	K15732	CTD phosphatase Fcp1 
SPBP8B7.14c	dpb2	K02325	DNA polymerase epsilon catalytic subunit B, Dpb2
SPCC16A11.04	snx12	K17887	sorting nexin Snx12 (predicted)
SPAC9G1.12	cpd1	K07442	tRNA (m1A) methyltransferase complex catalytic subunit Cpd1 
SPBC106.17c	cys2	K00641	homoserine O-acetyltransferase (predicted) 
SPCC1494.02c	taf13	K03127	transcription factor TFIID complex subunit Taf13 (predicted)
SPAC222.12c	atp2	K02133	F1-ATPase beta subunit Atp2 
SPBC3D6.10	apn2	K10772	AP-endonuclease Apn2
SPBC3D6.15	rps2501	K02975	40S ribosomal protein S25
SPCC18.07	rpc53	K03026	DNA-directed RNA polymerase III complex subunit Rpc53 (predicted)
SPCC18.04	pof6	K15071	F-box protein Pof6
SPBC725.02	mpr1	K11232	histidine-containing response regulator phosphotransferase Mpr1
SPCC70.07c	tmp1	K00943	thymidylate kinase Tmp1 
SPAC2G11.07c	ptc3	K04457	protein phosphatase 2C 
SPAC926.07c	dlc2	K10418	dynein light chain Dlc2 (predicted)
SPAP27G11.13c	nop10	K11130	snoRNP pseudouridylase box H/ACA snoRNP complex protein (predicted)
SPBC29A3.10c	atp14	K02141	F1-ATPase subunit H (predicted)
SPAC637.12c	mst1	K11304	KAT5 family histone acetyltransferase Mst1
SPAC644.17c	mrpl9	K02906	mitochondrial ribosomal protein subunit L9 (predicted)
SPBC21B10.11	dpm2	K09658	dolichol-phosphate mannosyltransferase subunit 2 (predicted)
SPBC21B10.10	rps402	K02987	40S ribosomal protein S4
SPBC21B10.14	ymr31	K17417	mitochondrial ribosomal protein Ymr1 (predicted)
SPAC2C4.03c	smd2	K11096	Sm snRNP core protein Smd2
SPAC3G9.08	png1	K11396	chromatin modification-related protein
SPBC56F2.10c	alg5	K00729	dolichyl-phosphate beta-glucosyltransferase Alg5 (predicted) 
SPCC16C4.09	sts5	K18748	RNB-like protein
SPAC3G9.04	ssu72	K15544	phosphoric ester hydrolase Ssu72 (predicted) 
SPAC3G9.06	frs2	K01889	cytoplasmic phenylalanine-tRNA ligase alpha subunit Frs2 (predicted) 
SPAC3G9.03	rpl2301	K02894	60S ribosomal protein L23
SPCC330.13	rpc37	K14721	DNA-directed RNA polymerase III complex subunit Rpc37 (predicted)
SPCC330.10	pcm1	K00565	P-TEFb-cap methyltransferase Pcm1 
SPAC8C9.06c	ppr4	K17669	mitochondrial translation regulator Ppr4
SPAC144.11	rps1102	K02949	40S ribosomal protein S11
SPCC16A11.05c	dim1	K12859	U4/U6 X U5 tri-snRNP complex subunit Dim1
SPAC3H1.13	ppk13	K08856	serine/threonine protein kinase Ppk13 (predicted)
SPAC144.18	vrg4	K15356	Golgi GDP-mannose transporter Vrg4 (predicted)
SPAPB1A10.09	ase1	K16732	antiparallel microtubule cross-linking factor Ase1
SPAC29A4.20	elp3	K07739	elongator complex, histone acetyltransferase subunit Elp3 (predicted)
SPBC26H8.10	dis3	K12585	3'-5' exoribonuclease subunit Dis3 (predicted)
SPBC12D12.02c	cdm1	K03505	DNA polymerase delta subunit Cdm1
SPBC887.18c	hfi1	K11362	SAGA complex subunit Hfi1
SPAC22H10.12c	gdi1	K17255	GDP dissociation inhibitor Gdi1 (predicted)
SPAC23C11.11	cka1	K03097	serine/threonine protein kinase Cka1 
SPBC13G1.12	did2	K12197	ESCRT III complex subunit Did2 (predicted)
SPBC13G1.13	tfb2	K03144	transcription factor TFIIH complex subunit Tfb2
SPAC23C11.14	zhf1	K14688	zinc ion transporter Zhf1
SPBC13G1.11	ykt6	K08516	SNARE Ykt6 (predicted)
SPBC4F6.15c	swi10	K10849	DNA repair endonuclease Swi10 
SPBC211.01	rsm10	K02946	mitochondrial ribosomal protein subunit S10 (predicted)
SPBC211.05	sab10	K12832	splicing factor 3B (predicted)
SPAC57A7.08	pzh1	K06269	serine/threonine protein phosphatase Pzh1
SPAC2C4.14c	ppk11	K08838	PAK-related kinase Ppk11
SPBC428.13c	mob1	K06685	Sid2-Mob1 kinase complex regulatory subunit Mob1
SPBC19G7.03c	rps3002	K02983	40S ribosomal protein S30
SPBP35G2.13c	swc2	K11664	Swr1 complex complex subunit Swc2
SPBC16H5.09c	omh2	K10967	alpha-1,2-mannosyltransferase Omh2 (predicted) 
SPAC1296.02	cox4	K02265	cytochrome c oxidase subunit IV (predicted)
SPBC776.18c	pmh1	K10842	transcription factor TFIIH complex subunit Pmh1
SPAC1296.06	tah18	K00327	NADPH-dependent diflavin oxidoreductase, involved in iron-sulfur cluster assembly Tah18 (predicted)
SPAC23C4.03	hrk1	K16315	haspin related kinase Hrk1
SPAC20G4.04c	hus1	K10903	checkpoint clamp complex protein Hus1
SPAPB1A10.10c	ypt71	K07976	GTPase Ypt71
SPCC290.03c	nup186	K14310	nucleoporin Nup186
SPAC31G5.03	rps1101	K02949	40S ribosomal protein S11
SPAC22H12.02	tfg3	K03140	transcription factor TFIIF complex subunit Tfg3
SPAC31G5.01	sap49	K12831	U2 snRNP-associated RNA-binding protein Sap49
SPAC22H10.07	scd2	K11237	scaffold protein Scd2
SPAC31G5.08	ups1	K01719	uroporphyrinogen-III synthase Ups1 
SPAC664.15	caf4	K17970	CCR4-Not complex subunit Caf4/Mdv1 (predicted)
SPAC664.10	klp2	K10405	kinesin-like protein Klp2
SPAC664.11	ssc1	K04043	mitochondrial heat shock protein Hsp70
SPBC19G7.09	ulp1	K08592	SUMO deconjugating enzyme Ulp1
SPBC1604.13c	mrpl32	K02911	mitochondrial ribosomal protein subunit L32 (predicted)
SPAC140.02	gar2	K11294	nucleolar protein required for rRNA processing
SPAC140.01	sdh2	K00235	succinate dehydrogenase iron-sulfur subunit protein 
SPBP23A10.08	alp5	K11400	actin-like protein Arp4
SPBP23A10.09	psf1	K10732	GINS complex subunit Psf1
SPBP23A10.07	rpa2	K03002	DNA-directed RNA polymerase I complex subunit Rpa2 
SPBP23A10.04	apc2	K03349	anaphase-promoting complex cullin family subunit Apc2
SPAC3A12.18	zwf1	K00036	glucose-6-phosphate 1-dehydrogenase (predicted) 
SPAC3A12.12	atp11	K07555	F1-ATPase chaperone Atp11 (predicted)
SPAC4D7.08c	ade4	K00764	amidophosphoribosyltransferase Ade4 
SPAC3A12.14	cam1	K02183	calmodulin Cam1
SPBC13E7.05	gpi14	K05284	pig-M (predicted)
SPBC13E7.04	atp16	K02134	F1-ATPase delta subunit (predicted)
SPBC13E7.01	cwf22	K13100	splicing factor Cwf22
SPBC13E7.02	cwf24	K13127	zf-C3HC4 type (RING finger)/GCN5-related N acetyltransferase fusion protein
SPAC23A1.15c	sec20	K08497	SNARE Sec20 (predicted)
SPBC27B12.01c	mmm1	K17764	Mdm10/Mdm12/Mmm1 complex subunit Mmm1 (predicted)
SPAC18G6.04c	shm2	K00600	serine hydroxymethyltransferase Shm2 (predicted) 
SPCC320.13c	ark1	K08850	aurora-B kinase Ark1
SPAC959.09c	apc5	K03352	anaphase-promoting complex subunit Apc5
SPCC1183.08c	rpl101	K02865	60S ribosomal protein L1
SPBC17D11.02c	hrd1	K10601	ubiquitin-protein ligase Hrd1, synviolin family
SPAC6F12.09	rdp1	K11699	RNA-directed RNA polymerase Rdp1 
SPAC17G8.13c	mst2	K11378	histone acetyltransferase Mst2
SPAC6F12.07	tom20	K17770	mitochondrial TOM complex subunit Tom20 (predicted)
SPAC23A1.08c	rpl3401	K02915	60S ribosomal protein L34
SPBC16H5.07c	ppa2	K04382	serine/threonine protein phosphatase Ppa2 
SPAC6G9.02c	nop9	K14790	RNA-binding protein Nop9 (predicted)
SPCC306.04c	set1	K11422	histone lysine methyltransferase Set1
SPBC11C11.03	ndc80	K11547	spindle pole body protein Ndc80
SPBC11C11.07	rpl1801	K02883	60S ribosomal protein L18
SPCC970.01	rad16	K10848	DNA repair endonuclease XPF 
SPAC22F3.08c	rok1	K14779	ATP-dependent RNA helicase Rok1 (predicted)
SPCC970.05	rpl3601	K02920	60S ribosomal protein L36
SPAC3H5.07	rpl702	K02937	60S ribosomal protein L7
SPAC15F9.02	seh1	K14299	nucleoporin Seh1
SPAC4G9.09c	arg11	K12659	N-acetyl-gamma-glutamyl-phosphate reductase/acetylglutamate kinase 
SPAC23C4.16c	atg15	K17900	autophagy associated lipase Atg15
SPAC23H4.07c	srp102	K12272	signal recognition particle receptor beta subunit Srp102 (predicted)
SPCC330.01c	rhp16	K15083	ATP-dependent helicase
SPBC31F10.04c	srb4	K15134	mediator complex subunit Srb4
SPAC27D7.14c	tpr1	K15176	RNA polymerase II associated Paf1 complex subunit Tpr1
SPAC3C7.06c	pit1	K12765	serine/threonine protein kinase, meiotic Pit1
SPAC23H3.02c	ini1	K12834	RING finger-like protein Ini1
SPBC1604.25	pet117	K18188	Pet117 cytochrome c oxidase assembly protein
SPCC162.07	ent1	K12471	epsin
SPAC13F5.03c	gld1	K00005	mitochondrial glycerol dehydrogenase Gld1
SPBC21H7.05	sfc6	K15205	transcription factor TFIIIC complex subunit Sfc6
SPBC21H7.04	dbp7	K14806	ATP-dependent RNA helicase Dbp7 (predicted)
SPAC8E11.07c	alp31	K17292	tubulin specific chaperone cofactor A, Alp31
SPBC21H7.02	taf10	K03134	SAGA complex/transcription factor TFIID complex subunit Taf10
SPAC5D6.06c	alg14	K07441	UDP-GlcNAc transferase associated protein Alg14 (predicted)
SPBC215.12	cwf10	K12852	GTPase Cwf10 (predicted)
SPBC146.07	prp2	K12837	U2AF large subunit (U2AF-59)
SPAC17A5.07c	ulp2	K08596	SUMO deconjugating cysteine peptidase Ulp2 (predicted)
SPBC146.01	med15	K15158	mediator complex subunit Med15
SPAC23H4.11c	cnl2	K11696	centromere localized protein Cnl2
SPCC622.09	htb1	K11252	histone H2B Htb1
SPBC405.04c	ypt7	K07897	GTPase Ypt7
SPBC2D10.10c	fib1	K14563	fibrillarin
SPCC1682.01	qcr9	K00419	ubiquinol-cytochrome-c reductase complex subunit 9 (predicted) 
SPBC29A3.15c	rsm23	K17408	mitochondrial ribosomal protein subunit S23 (predicted)
SPCC1919.14c	bdp1	K15198	transcription factor TFIIIB complex subunit Bdp1 (predicted)
SPCC1682.04	cdc31	K16466	centrin
SPCC1682.07	ssl1	K03142	transcription factor TFIIH complex subunit Ssl1
SPAP8A3.09c	paa1	K03456	protein phosphatase regulatory subunit Paa1
SPBC18E5.03c	sim4	K11698	kinetochore protein sim4
SPCC320.12	atp23	K18156	mitochondrial inner membrane peptidase Atp23 (predicted)
SPCC320.10	srp72	K03108	signal recognition particle subunit Srp72 (predicted)
SPBC3B8.10c	nem1	K17617	Nem1-Spo7 phosphatase complex catalytic subunit Nem1 (predicted)
